{
  "$schema": "https://json-schema.org/draft/2020-12/schema",
  "$id": "urn:pto-isa:agentic-circuit:schema:acpy:0.1",
  "title": "Agentic Circuit ACPy 0.1",
  "type": "object",
  "additionalProperties": false,
  "required": ["schema", "version", "contract_epoch", "entry", "sources", "entities"],
  "properties": {
    "schema": {"const": "agentic-circuit-acpy"},
    "version": {"const": "0.1"},
    "contract_epoch": {"const": "0.3"},
    "entry": {"$ref": "#/$defs/entityId"},
    "sources": {"type": "array", "items": {"$ref": "#/$defs/sourceFile"}},
    "entities": {"type": "array", "items": {"$ref": "#/$defs/entity"}}
  },
  "$defs": {
    "sha256": {"type": "string", "pattern": "^sha256:[0-9a-f]{64}$"},
    "entityId": {"type": "string", "pattern": "^e[0-9]+$"},
    "sourceFile": {
      "type": "object",
      "additionalProperties": false,
      "required": ["path", "sha256"],
      "properties": {
        "path": {"type": "string", "minLength": 1},
        "sha256": {"$ref": "#/$defs/sha256"}
      }
    },
    "sourceSpan": {
      "type": "object",
      "additionalProperties": false,
      "required": ["file", "start_line", "start_column", "end_line", "end_column"],
      "properties": {
        "file": {"type": "string", "minLength": 1},
        "start_line": {"type": "integer", "minimum": 1},
        "start_column": {"type": "integer", "minimum": 1},
        "end_line": {"type": "integer", "minimum": 1},
        "end_column": {"type": "integer", "minimum": 1}
      }
    },
    "schemaRef": {
      "type": "object",
      "additionalProperties": false,
      "required": ["identity", "fingerprint"],
      "properties": {
        "identity": {"type": "string", "minLength": 1},
        "fingerprint": {"$ref": "#/$defs/sha256"}
      }
    },
    "property": {
      "type": "object",
      "additionalProperties": false,
      "required": ["name", "value"],
      "properties": {
        "name": {"type": "string", "pattern": "^[A-Za-z_][A-Za-z0-9_]*$"},
        "value": {"$ref": "#/$defs/jsonValue"}
      }
    },
    "entity": {
      "type": "object",
      "additionalProperties": false,
      "required": ["id", "kind", "source", "parent", "scope", "type", "definition", "uses", "schema_ref", "properties"],
      "properties": {
        "id": {"$ref": "#/$defs/entityId"},
        "kind": {"enum": ["system", "module", "scope", "arg", "call", "result", "get_result", "bind", "static_if", "static_for", "collection", "get_static", "return", "capture", "escape", "process"]},
        "source": {"oneOf": [{"type": "null"}, {"$ref": "#/$defs/sourceSpan"}]},
        "parent": {"oneOf": [{"type": "null"}, {"$ref": "#/$defs/entityId"}]},
        "scope": {"type": "string", "minLength": 1},
        "type": {"type": ["string", "null"]},
        "definition": {"oneOf": [{"type": "null"}, {"$ref": "#/$defs/entityId"}]},
        "uses": {"type": "array", "items": {"$ref": "#/$defs/entityId"}, "uniqueItems": true},
        "schema_ref": {"oneOf": [{"type": "null"}, {"$ref": "#/$defs/schemaRef"}]},
        "properties": {"type": "array", "items": {"$ref": "#/$defs/property"}}
      }
    },
    "jsonScalar": {"type": ["string", "number", "boolean", "null"]},
    "jsonValue": {
      "oneOf": [
        {"$ref": "#/$defs/jsonScalar"},
        {"type": "array", "items": {"$ref": "#/$defs/jsonValue"}},
        {"type": "object", "additionalProperties": {"$ref": "#/$defs/jsonValue"}}
      ]
    }
  }
}
